<?xml version="1.0"?>
<CourseDetails xmlns:xsi="http://www.w3.org/2001/XMLSchema-instance" xsi:schemaLocation="Course1.xsd">

	<Course courseid ="1">
        <course_name>Servlet</course_name>
        <location>Pune</location>
        <labno>F101</labno>
        <facultyid>101</facultyid>
		<startdate>12-Apr-2016</startdate>
		<enddate>14-Apr-2016</enddate>
    </Course>
	
	<Course courseid ="2">
        <course_name>JSP2.2</course_name>
        <location>Pune</location>
        <labno>F102</labno>
        <facultyid>103</facultyid>
		<startdate>5-Oct-2016</startdate>
		<enddate>8-Oct-2016</enddate>
    </Course>
	
	<Course courseid ="3">
        <course_name>Windows Programming</course_name>
        <location>Mumbai</location>
        <labno>G103</labno>
        <facultyid>103</facultyid>
		<startdate>2-may-2016</startdate>
		<enddate>8-May-2016</enddate>
    </Course>
	
	<Course courseid ="4">
        <course_name>OOP and UML</course_name>
        <location>Mumbai</location>
        <labno>G101</labno>
        <facultyid>104</facultyid>
		<startdate>3-Apr-2016</startdate>
		<enddate>4-Jan-2016</enddate>
    </Course>
	
	<Course courseid ="5">
        <course_name>HTML5</course_name>
        <location>Bangalore</location>
        <labno>G101</labno>
        <facultyid>104</facultyid>
		<startdate>09-Nov-2016</startdate>
		<enddate>12-Nov-2016</enddate>
    </Course>

	<Course courseid ="6">
        <course_name>Windows Presentation</course_name>
        <location>Bangalore</location>
        <labno>G101</labno>
        <facultyid>104</facultyid>
		<startdate>16-July-2016</startdate>
		<enddate>22-July-2016</enddate>
    </Course>
</CourseDetails>
    